{
  "catalog_api_version": "io.tobkiri.pack-contract-catalog.v4",
  "contracts": [
    {
      "contract_api_version": "io.tobkiri.contract.v4",
      "contract_id": "tobkiri.service.tool.executor.select.v1",
      "operations": [
        {
          "effect_ceiling": [
            "capability:tool.executor.select",
            "host:brokered-execution"
          ],
          "error_schema_digest": "sha256:a2c799262a3ce3c19ef5cdd983bf3d12b43ab3c426227091b909dcb7054738c0",
          "idempotency": {
            "mode": "none"
          },
          "input_schema_digest": "sha256:a2c799262a3ce3c19ef5cdd983bf3d12b43ab3c426227091b909dcb7054738c0",
          "operation_id": "rumi_tool_executor_selector_pack.tool-executor-select",
          "output_schema_digest": "sha256:a2c799262a3ce3c19ef5cdd983bf3d12b43ab3c426227091b909dcb7054738c0",
          "scope_semantics": "host_broker"
        }
      ],
      "owner": "rumi_tool_executor_selector_pack",
      "provenance": {
        "evidence": [
          {
            "digest": "sha256:b793d25967b539c2e2bc43eb8aa1f4d74751c25a0ef8790a0f6c25b03c6a3f69",
            "path": "schemas/pack_v4_catalog.v1.json",
            "rule_id": "canonical-pack-v4-source-record"
          }
        ],
        "generator": "tobkiri.scripts.migrate_pack_artifacts_v4",
        "generator_version": "1.0.0",
        "normative": true,
        "repository_commit": "1329f300cd2a8e15170edb1accce8d7c3167882b",
        "repository_tree": "8820370fd87572920444d7c9dc642735b35194e6e1610ad99d242a5958fb876c",
        "schema": "io.tobkiri.provenance.v1",
        "source_digest": "sha256:b793d25967b539c2e2bc43eb8aa1f4d74751c25a0ef8790a0f6c25b03c6a3f69",
        "source_kind": "migration",
        "source_path": "schemas/pack_v4_catalog.v1.json#/packs/rumi_tool_executor_selector_pack"
      },
      "provider_semantics": {
        "cardinality": "one",
        "failure": "fail_closed",
        "isolation": "in_process",
        "lifecycle": {
          "data_owner": "caller",
          "deprecated": false,
          "introduced": "1.0.0"
        },
        "provider_id": "rumi_tool_executor_selector_pack.tool-executor-selector.select",
        "required_capabilities": [
          "tool.executor.select"
        ],
        "security": "sensitive"
      },
      "revision_digest": "sha256:1d465f810bc34504e4fbb81be31274f01aef689ad2ffbb13f12f898cb0e3b22c",
      "schema_catalog": {
        "sha256:a2c799262a3ce3c19ef5cdd983bf3d12b43ab3c426227091b909dcb7054738c0": {
          "type": "object"
        }
      },
      "status": "accepted",
      "version": "1.0.0"
    }
  ],
  "pack_id": "rumi_tool_executor_selector_pack",
  "source_identity": "sha256:b793d25967b539c2e2bc43eb8aa1f4d74751c25a0ef8790a0f6c25b03c6a3f69"
}
