{
  "catalog_api_version": "io.tobkiri.pack-contract-catalog.v4",
  "contracts": [
    {
      "contract_api_version": "io.tobkiri.contract.v4",
      "contract_id": "tobkiri.action.connector.oauth.v1",
      "operations": [
        {
          "effect_ceiling": [
            "capability:connector.oauth.manage"
          ],
          "error_schema_digest": "sha256:a2c799262a3ce3c19ef5cdd983bf3d12b43ab3c426227091b909dcb7054738c0",
          "idempotency": {
            "mode": "none"
          },
          "input_schema_digest": "sha256:a2c799262a3ce3c19ef5cdd983bf3d12b43ab3c426227091b909dcb7054738c0",
          "operation_id": "rumi_connector_oauth_broker_pack.connector-oauth-action",
          "output_schema_digest": "sha256:a2c799262a3ce3c19ef5cdd983bf3d12b43ab3c426227091b909dcb7054738c0",
          "scope_semantics": "declarative"
        }
      ],
      "owner": "rumi_connector_oauth_broker_pack",
      "provenance": {
        "evidence": [
          {
            "digest": "sha256:27512b8664810eb4db7e39616d0e62da64e16359815b176a8130e2b513cdf5ea",
            "path": "schemas/pack_v4_catalog.v1.json",
            "rule_id": "canonical-pack-v4-source-record"
          }
        ],
        "generator": "tobkiri.scripts.migrate_pack_artifacts_v4",
        "generator_version": "1.0.0",
        "normative": true,
        "repository_commit": "1329f300cd2a8e15170edb1accce8d7c3167882b",
        "repository_tree": "8820370fd87572920444d7c9dc642735b35194e6e1610ad99d242a5958fb876c",
        "schema": "io.tobkiri.provenance.v1",
        "source_digest": "sha256:27512b8664810eb4db7e39616d0e62da64e16359815b176a8130e2b513cdf5ea",
        "source_kind": "migration",
        "source_path": "schemas/pack_v4_catalog.v1.json#/packs/rumi_connector_oauth_broker_pack"
      },
      "provider_semantics": {
        "cardinality": "one",
        "failure": "fail_closed",
        "isolation": "process",
        "lifecycle": {
          "data_owner": "rumi_connector_oauth_broker_pack",
          "deprecated": false,
          "introduced": "1.0.0"
        },
        "provider_id": "rumi_connector_oauth_broker_pack.connector-oauth.action",
        "required_capabilities": [
          "connector.oauth.manage"
        ],
        "security": "restricted"
      },
      "revision_digest": "sha256:295bd4d95e33a945a2d54b9924bfdc91a533caf4233d74ca5d607667829a5ad3",
      "schema_catalog": {
        "sha256:a2c799262a3ce3c19ef5cdd983bf3d12b43ab3c426227091b909dcb7054738c0": {
          "type": "object"
        }
      },
      "status": "accepted",
      "version": "1.0.0"
    },
    {
      "contract_api_version": "io.tobkiri.contract.v4",
      "contract_id": "tobkiri.resource.connector.oauth.v1",
      "operations": [
        {
          "effect_ceiling": [
            "capability:connector.oauth.read"
          ],
          "error_schema_digest": "sha256:a2c799262a3ce3c19ef5cdd983bf3d12b43ab3c426227091b909dcb7054738c0",
          "idempotency": {
            "mode": "none"
          },
          "input_schema_digest": "sha256:a2c799262a3ce3c19ef5cdd983bf3d12b43ab3c426227091b909dcb7054738c0",
          "operation_id": "rumi_connector_oauth_broker_pack.connector-oauth-resource",
          "output_schema_digest": "sha256:a2c799262a3ce3c19ef5cdd983bf3d12b43ab3c426227091b909dcb7054738c0",
          "scope_semantics": "declarative"
        }
      ],
      "owner": "rumi_connector_oauth_broker_pack",
      "provenance": {
        "evidence": [
          {
            "digest": "sha256:27512b8664810eb4db7e39616d0e62da64e16359815b176a8130e2b513cdf5ea",
            "path": "schemas/pack_v4_catalog.v1.json",
            "rule_id": "canonical-pack-v4-source-record"
          }
        ],
        "generator": "tobkiri.scripts.migrate_pack_artifacts_v4",
        "generator_version": "1.0.0",
        "normative": true,
        "repository_commit": "1329f300cd2a8e15170edb1accce8d7c3167882b",
        "repository_tree": "8820370fd87572920444d7c9dc642735b35194e6e1610ad99d242a5958fb876c",
        "schema": "io.tobkiri.provenance.v1",
        "source_digest": "sha256:27512b8664810eb4db7e39616d0e62da64e16359815b176a8130e2b513cdf5ea",
        "source_kind": "migration",
        "source_path": "schemas/pack_v4_catalog.v1.json#/packs/rumi_connector_oauth_broker_pack"
      },
      "provider_semantics": {
        "cardinality": "one",
        "failure": "isolate",
        "isolation": "process",
        "lifecycle": {
          "data_owner": "rumi_connector_oauth_broker_pack",
          "deprecated": false,
          "introduced": "1.0.0"
        },
        "provider_id": "rumi_connector_oauth_broker_pack.connector-oauth.resource",
        "required_capabilities": [
          "connector.oauth.read"
        ],
        "security": "sensitive"
      },
      "revision_digest": "sha256:354355b822d7ed764828bbf3e73ef06a6955c2214398eaf4932ce5ea985bea83",
      "schema_catalog": {
        "sha256:a2c799262a3ce3c19ef5cdd983bf3d12b43ab3c426227091b909dcb7054738c0": {
          "type": "object"
        }
      },
      "status": "accepted",
      "version": "1.0.0"
    },
    {
      "contract_api_version": "io.tobkiri.contract.v4",
      "contract_id": "tobkiri.transport.connector.oauth.callback.v1",
      "operations": [
        {
          "effect_ceiling": [
            "capability:connector.oauth.callback"
          ],
          "error_schema_digest": "sha256:a2c799262a3ce3c19ef5cdd983bf3d12b43ab3c426227091b909dcb7054738c0",
          "idempotency": {
            "mode": "none"
          },
          "input_schema_digest": "sha256:a2c799262a3ce3c19ef5cdd983bf3d12b43ab3c426227091b909dcb7054738c0",
          "operation_id": "rumi_connector_oauth_broker_pack.connector-oauth-callback",
          "output_schema_digest": "sha256:a2c799262a3ce3c19ef5cdd983bf3d12b43ab3c426227091b909dcb7054738c0",
          "scope_semantics": "declarative"
        }
      ],
      "owner": "rumi_connector_oauth_broker_pack",
      "provenance": {
        "evidence": [
          {
            "digest": "sha256:27512b8664810eb4db7e39616d0e62da64e16359815b176a8130e2b513cdf5ea",
            "path": "schemas/pack_v4_catalog.v1.json",
            "rule_id": "canonical-pack-v4-source-record"
          }
        ],
        "generator": "tobkiri.scripts.migrate_pack_artifacts_v4",
        "generator_version": "1.0.0",
        "normative": true,
        "repository_commit": "1329f300cd2a8e15170edb1accce8d7c3167882b",
        "repository_tree": "8820370fd87572920444d7c9dc642735b35194e6e1610ad99d242a5958fb876c",
        "schema": "io.tobkiri.provenance.v1",
        "source_digest": "sha256:27512b8664810eb4db7e39616d0e62da64e16359815b176a8130e2b513cdf5ea",
        "source_kind": "migration",
        "source_path": "schemas/pack_v4_catalog.v1.json#/packs/rumi_connector_oauth_broker_pack"
      },
      "provider_semantics": {
        "cardinality": "one",
        "failure": "fail_closed",
        "isolation": "process",
        "lifecycle": {
          "data_owner": "rumi_connector_oauth_broker_pack",
          "deprecated": false,
          "introduced": "1.0.0"
        },
        "provider_id": "rumi_connector_oauth_broker_pack.connector-oauth.callback",
        "required_capabilities": [
          "connector.oauth.callback"
        ],
        "security": "restricted"
      },
      "revision_digest": "sha256:bfa6d64858a26620c6cbe913a02eb408b6990cb412b2ec17d6a67e52a9e04a72",
      "schema_catalog": {
        "sha256:a2c799262a3ce3c19ef5cdd983bf3d12b43ab3c426227091b909dcb7054738c0": {
          "type": "object"
        }
      },
      "status": "accepted",
      "version": "1.0.0"
    }
  ],
  "pack_id": "rumi_connector_oauth_broker_pack",
  "source_identity": "sha256:27512b8664810eb4db7e39616d0e62da64e16359815b176a8130e2b513cdf5ea"
}
