{
  "catalog_api_version": "io.tobkiri.pack-contract-catalog.v4",
  "contracts": [
    {
      "contract_api_version": "io.tobkiri.contract.v4",
      "contract_id": "tobkiri.resource.managed-desktops.v1",
      "operations": [
        {
          "effect_ceiling": [
            "capability:desktop.read"
          ],
          "error_schema_digest": "sha256:a2c799262a3ce3c19ef5cdd983bf3d12b43ab3c426227091b909dcb7054738c0",
          "idempotency": {
            "mode": "none"
          },
          "input_schema_digest": "sha256:0843ea516ca0e425042fa2dade08f74c41051ebd61da7d04cab6c8fcfce823e6",
          "operation_id": "rumi_sandbox_runtime_pack.desktops-list",
          "output_schema_digest": "sha256:a2c799262a3ce3c19ef5cdd983bf3d12b43ab3c426227091b909dcb7054738c0",
          "scope_semantics": "host_broker"
        },
        {
          "effect_ceiling": [
            "capability:desktop.read"
          ],
          "error_schema_digest": "sha256:a2c799262a3ce3c19ef5cdd983bf3d12b43ab3c426227091b909dcb7054738c0",
          "idempotency": {
            "mode": "none"
          },
          "input_schema_digest": "sha256:0843ea516ca0e425042fa2dade08f74c41051ebd61da7d04cab6c8fcfce823e6",
          "operation_id": "rumi_sandbox_runtime_pack.runtime-providers-read",
          "output_schema_digest": "sha256:a2c799262a3ce3c19ef5cdd983bf3d12b43ab3c426227091b909dcb7054738c0",
          "scope_semantics": "host_broker"
        },
        {
          "effect_ceiling": [
            "capability:desktop.read"
          ],
          "error_schema_digest": "sha256:a2c799262a3ce3c19ef5cdd983bf3d12b43ab3c426227091b909dcb7054738c0",
          "idempotency": {
            "mode": "none"
          },
          "input_schema_digest": "sha256:0843ea516ca0e425042fa2dade08f74c41051ebd61da7d04cab6c8fcfce823e6",
          "operation_id": "rumi_sandbox_runtime_pack.runtime-doctor-read",
          "output_schema_digest": "sha256:a2c799262a3ce3c19ef5cdd983bf3d12b43ab3c426227091b909dcb7054738c0",
          "scope_semantics": "host_broker"
        },
        {
          "effect_ceiling": [
            "capability:desktop.read"
          ],
          "error_schema_digest": "sha256:a2c799262a3ce3c19ef5cdd983bf3d12b43ab3c426227091b909dcb7054738c0",
          "idempotency": {
            "mode": "none"
          },
          "input_schema_digest": "sha256:0843ea516ca0e425042fa2dade08f74c41051ebd61da7d04cab6c8fcfce823e6",
          "operation_id": "rumi_sandbox_runtime_pack.sandbox-templates-read",
          "output_schema_digest": "sha256:a2c799262a3ce3c19ef5cdd983bf3d12b43ab3c426227091b909dcb7054738c0",
          "scope_semantics": "host_broker"
        }
      ],
      "owner": "rumi_sandbox_runtime_pack",
      "provenance": {
        "evidence": [
          {
            "digest": "sha256:a72d0bf9456d64afa3b3121daf336f16e91f415284d070600be69add79d9cfb2",
            "path": "schemas/pack_v4_catalog.v1.json",
            "rule_id": "canonical-pack-v4-source-record"
          }
        ],
        "generator": "tobkiri.scripts.migrate_pack_artifacts_v4",
        "generator_version": "1.0.0",
        "normative": true,
        "repository_commit": "1329f300cd2a8e15170edb1accce8d7c3167882b",
        "repository_tree": "8820370fd87572920444d7c9dc642735b35194e6e1610ad99d242a5958fb876c",
        "schema": "io.tobkiri.provenance.v1",
        "source_digest": "sha256:a72d0bf9456d64afa3b3121daf336f16e91f415284d070600be69add79d9cfb2",
        "source_kind": "migration",
        "source_path": "schemas/pack_v4_catalog.v1.json#/packs/rumi_sandbox_runtime_pack"
      },
      "provider_semantics": {
        "cardinality": "one",
        "failure": "fail_closed",
        "isolation": "in_process",
        "lifecycle": {
          "deprecated": false,
          "introduced": "1.0.0"
        },
        "provider_id": "tobkiri.managed-desktops.read",
        "required_capabilities": [
          "desktop.read"
        ],
        "security": "sensitive"
      },
      "revision_digest": "sha256:a60b6eb2eab9da9f87f18ecb6e86978b01d49b7cdddaa7cb79aaad315ca781c1",
      "schema_catalog": {
        "sha256:0843ea516ca0e425042fa2dade08f74c41051ebd61da7d04cab6c8fcfce823e6": {
          "additionalProperties": false,
          "properties": {
            "_session_id": {
              "type": "string"
            },
            "profile_id": {
              "maxLength": 128,
              "minLength": 1,
              "type": "string"
            }
          },
          "required": [
            "profile_id"
          ],
          "type": "object"
        },
        "sha256:a2c799262a3ce3c19ef5cdd983bf3d12b43ab3c426227091b909dcb7054738c0": {
          "type": "object"
        }
      },
      "status": "accepted",
      "version": "1.0.0"
    }
  ],
  "pack_id": "rumi_sandbox_runtime_pack",
  "source_identity": "sha256:a72d0bf9456d64afa3b3121daf336f16e91f415284d070600be69add79d9cfb2"
}
