{
  "catalog_api_version": "io.tobkiri.pack-contract-catalog.v4",
  "contracts": [
    {
      "contract_api_version": "io.tobkiri.contract.v4",
      "contract_id": "tobkiri.resource.conversation.lifecycle.v1",
      "operations": [
        {
          "effect_ceiling": [
            "capability:conversation.lifecycle.read",
            "host:brokered-execution"
          ],
          "error_schema_digest": "sha256:a2c799262a3ce3c19ef5cdd983bf3d12b43ab3c426227091b909dcb7054738c0",
          "idempotency": {
            "mode": "none"
          },
          "input_schema_digest": "sha256:83445aed0fdb09b3914bb6ef42d9aa15d5f4e107a9ca0e8a03583e72255adb79",
          "operation_id": "tobkiri_conversation_lifecycle_pack.lifecycle-status",
          "output_schema_digest": "sha256:a2c799262a3ce3c19ef5cdd983bf3d12b43ab3c426227091b909dcb7054738c0",
          "scope_semantics": "host_broker"
        }
      ],
      "owner": "tobkiri_conversation_lifecycle_pack",
      "provenance": {
        "evidence": [],
        "generator": "tobkiri-protocol",
        "generator_version": "1.0.0",
        "normative": false,
        "repository_commit": "58037150a3c01dd45cbd3e6e0de95ff7ff119c92",
        "repository_tree": "483556709d4cecae9ae777c526ba2436cf55b4216686e7ad86a780c085d6b920",
        "schema": "io.tobkiri.provenance.v1",
        "source_digest": "sha256:1540023c74bea2ba36bbebee67caf6f1237bdae8e8f5be051bd3548ea520a64f",
        "source_kind": "repository",
        "source_path": "ecosystem/tobkiri_conversation_lifecycle_pack/pack-source.v1.json"
      },
      "provider_semantics": {
        "cardinality": "one",
        "failure": "fail_closed",
        "isolation": "in_process",
        "lifecycle": {
          "data_owner": "tobkiri_conversation_lifecycle_pack",
          "introduced": "1.0.0"
        },
        "provider_id": "tobkiri_conversation_lifecycle_pack.status",
        "required_capabilities": [
          "conversation.lifecycle.read"
        ],
        "security": "restricted"
      },
      "revision_digest": "sha256:2153a87b4a8416a9c9464ca4e1dfc0b60ce9eb5ae582944f934abeae777f659b",
      "schema_catalog": {
        "sha256:83445aed0fdb09b3914bb6ef42d9aa15d5f4e107a9ca0e8a03583e72255adb79": {
          "additionalProperties": false,
          "properties": {
            "_session_id": {
              "type": "string"
            },
            "conversation_id": {
              "minLength": 1,
              "type": "string"
            },
            "operation": {
              "const": "get"
            },
            "profile_id": {
              "minLength": 1,
              "type": "string"
            }
          },
          "required": [
            "profile_id",
            "operation",
            "conversation_id"
          ],
          "type": "object"
        },
        "sha256:a2c799262a3ce3c19ef5cdd983bf3d12b43ab3c426227091b909dcb7054738c0": {
          "type": "object"
        }
      },
      "status": "accepted",
      "version": "1.0.0"
    },
    {
      "contract_api_version": "io.tobkiri.contract.v4",
      "contract_id": "tobkiri.action.conversation.lifecycle.v1",
      "operations": [
        {
          "effect_ceiling": [
            "capability:conversation.lifecycle.manage",
            "host:brokered-execution"
          ],
          "error_schema_digest": "sha256:a2c799262a3ce3c19ef5cdd983bf3d12b43ab3c426227091b909dcb7054738c0",
          "idempotency": {
            "mode": "none"
          },
          "input_schema_digest": "sha256:a3228d3d58829f53ed54f752a8d82dbcbe783a390fc7d42f41166300a11e29de",
          "operation_id": "tobkiri_conversation_lifecycle_pack.lifecycle-manage",
          "output_schema_digest": "sha256:a2c799262a3ce3c19ef5cdd983bf3d12b43ab3c426227091b909dcb7054738c0",
          "scope_semantics": "host_broker"
        }
      ],
      "owner": "tobkiri_conversation_lifecycle_pack",
      "provenance": {
        "evidence": [],
        "generator": "tobkiri-protocol",
        "generator_version": "1.0.0",
        "normative": false,
        "repository_commit": "58037150a3c01dd45cbd3e6e0de95ff7ff119c92",
        "repository_tree": "483556709d4cecae9ae777c526ba2436cf55b4216686e7ad86a780c085d6b920",
        "schema": "io.tobkiri.provenance.v1",
        "source_digest": "sha256:1540023c74bea2ba36bbebee67caf6f1237bdae8e8f5be051bd3548ea520a64f",
        "source_kind": "repository",
        "source_path": "ecosystem/tobkiri_conversation_lifecycle_pack/pack-source.v1.json"
      },
      "provider_semantics": {
        "cardinality": "one",
        "failure": "fail_closed",
        "isolation": "in_process",
        "lifecycle": {
          "data_owner": "tobkiri_conversation_lifecycle_pack",
          "introduced": "1.0.0"
        },
        "provider_id": "tobkiri_conversation_lifecycle_pack.manage",
        "required_capabilities": [
          "conversation.lifecycle.manage"
        ],
        "security": "restricted"
      },
      "revision_digest": "sha256:eb2a7705f3eb379b985c46708345b9d2315c1e1589e1ab3d7d5035a46c17cf11",
      "schema_catalog": {
        "sha256:a2c799262a3ce3c19ef5cdd983bf3d12b43ab3c426227091b909dcb7054738c0": {
          "type": "object"
        },
        "sha256:a3228d3d58829f53ed54f752a8d82dbcbe783a390fc7d42f41166300a11e29de": {
          "additionalProperties": false,
          "properties": {
            "_session_id": {
              "type": "string"
            },
            "conversation_id": {
              "minLength": 1,
              "type": "string"
            },
            "mode": {
              "enum": [
                "manual",
                "archive_after_completion"
              ]
            },
            "operation": {
              "const": "configure"
            },
            "profile_id": {
              "minLength": 1,
              "type": "string"
            }
          },
          "required": [
            "profile_id",
            "operation",
            "conversation_id",
            "mode"
          ],
          "type": "object"
        }
      },
      "status": "accepted",
      "version": "1.0.0"
    },
    {
      "contract_api_version": "io.tobkiri.contract.v4",
      "contract_id": "tobkiri.action.job.adapter.v1",
      "operations": [
        {
          "effect_ceiling": [
            "capability:conversation.lifecycle.archive",
            "host:brokered-execution"
          ],
          "error_schema_digest": "sha256:a2c799262a3ce3c19ef5cdd983bf3d12b43ab3c426227091b909dcb7054738c0",
          "idempotency": {
            "mode": "none"
          },
          "input_schema_digest": "sha256:d88c0e445cff94ffdfe9bb4e721ff36a0e835265e51e871ded9ec7d94fb3e3c2",
          "operation_id": "tobkiri_conversation_lifecycle_pack.archive-job-adapter",
          "output_schema_digest": "sha256:a2c799262a3ce3c19ef5cdd983bf3d12b43ab3c426227091b909dcb7054738c0",
          "scope_semantics": "host_broker"
        }
      ],
      "owner": "tobkiri_conversation_lifecycle_pack",
      "provenance": {
        "evidence": [],
        "generator": "tobkiri-protocol",
        "generator_version": "1.0.0",
        "normative": false,
        "repository_commit": "58037150a3c01dd45cbd3e6e0de95ff7ff119c92",
        "repository_tree": "483556709d4cecae9ae777c526ba2436cf55b4216686e7ad86a780c085d6b920",
        "schema": "io.tobkiri.provenance.v1",
        "source_digest": "sha256:1540023c74bea2ba36bbebee67caf6f1237bdae8e8f5be051bd3548ea520a64f",
        "source_kind": "repository",
        "source_path": "ecosystem/tobkiri_conversation_lifecycle_pack/pack-source.v1.json"
      },
      "provider_semantics": {
        "cardinality": "many",
        "failure": "fail_closed",
        "instance_key": "conversation-lifecycle.archive-due",
        "isolation": "in_process",
        "lifecycle": {
          "data_owner": "tobkiri_conversation_lifecycle_pack",
          "introduced": "1.0.0"
        },
        "provider_id": "tobkiri_conversation_lifecycle_pack.archive-job",
        "required_capabilities": [
          "conversation.lifecycle.archive"
        ],
        "security": "restricted"
      },
      "revision_digest": "sha256:3cd700172901931f15b6a100d809c44d9f545fcde007475215839f3fe20125e6",
      "schema_catalog": {
        "sha256:a2c799262a3ce3c19ef5cdd983bf3d12b43ab3c426227091b909dcb7054738c0": {
          "type": "object"
        },
        "sha256:d88c0e445cff94ffdfe9bb4e721ff36a0e835265e51e871ded9ec7d94fb3e3c2": {
          "additionalProperties": false,
          "properties": {
            "action_id": {
              "maxLength": 256,
              "minLength": 1,
              "pattern": "^[A-Za-z0-9][A-Za-z0-9._:/-]{0,255}$",
              "type": "string"
            },
            "idempotency_key": {
              "maxLength": 256,
              "minLength": 1,
              "pattern": "^[A-Za-z0-9][A-Za-z0-9._:/-]{0,255}$",
              "type": "string"
            },
            "lease_id": {
              "maxLength": 256,
              "type": "string"
            },
            "operation": {
              "enum": [
                "describe",
                "dispatch",
                "cancel",
                "status"
              ]
            },
            "payload": {
              "type": "object"
            },
            "profile_id": {
              "maxLength": 256,
              "minLength": 1,
              "pattern": "^[A-Za-z0-9][A-Za-z0-9._:/-]{0,255}$",
              "type": "string"
            },
            "schedule_id": {
              "maxLength": 256,
              "type": "string"
            }
          },
          "required": [
            "operation"
          ],
          "type": "object"
        }
      },
      "status": "accepted",
      "version": "1.0.0"
    }
  ],
  "pack_id": "tobkiri_conversation_lifecycle_pack",
  "source_identity": "sha256:1540023c74bea2ba36bbebee67caf6f1237bdae8e8f5be051bd3548ea520a64f"
}
