{
  "catalog_api_version": "io.tobkiri.pack-contract-catalog.v4",
  "contracts": [
    {
      "contract_api_version": "io.tobkiri.contract.v4",
      "contract_id": "tobkiri.service.tool.authorize.v1",
      "operations": [
        {
          "effect_ceiling": [
            "capability:tool.authority.consume",
            "host:brokered-execution"
          ],
          "error_schema_digest": "sha256:a2c799262a3ce3c19ef5cdd983bf3d12b43ab3c426227091b909dcb7054738c0",
          "idempotency": {
            "mode": "none"
          },
          "input_schema_digest": "sha256:a2c799262a3ce3c19ef5cdd983bf3d12b43ab3c426227091b909dcb7054738c0",
          "operation_id": "rumi_tool_approval_bridge_pack.tool-authorize",
          "output_schema_digest": "sha256:a2c799262a3ce3c19ef5cdd983bf3d12b43ab3c426227091b909dcb7054738c0",
          "scope_semantics": "host_broker"
        }
      ],
      "owner": "rumi_tool_approval_bridge_pack",
      "provenance": {
        "evidence": [
          {
            "digest": "sha256:875d534c9a41b2844e4bd78cba38740dd66f9d108ab238649d8d1123989bf00a",
            "path": "schemas/pack_v4_catalog.v1.json",
            "rule_id": "canonical-pack-v4-source-record"
          }
        ],
        "generator": "tobkiri.scripts.migrate_pack_artifacts_v4",
        "generator_version": "1.0.0",
        "normative": true,
        "repository_commit": "1329f300cd2a8e15170edb1accce8d7c3167882b",
        "repository_tree": "8820370fd87572920444d7c9dc642735b35194e6e1610ad99d242a5958fb876c",
        "schema": "io.tobkiri.provenance.v1",
        "source_digest": "sha256:875d534c9a41b2844e4bd78cba38740dd66f9d108ab238649d8d1123989bf00a",
        "source_kind": "migration",
        "source_path": "schemas/pack_v4_catalog.v1.json#/packs/rumi_tool_approval_bridge_pack"
      },
      "provider_semantics": {
        "cardinality": "one",
        "failure": "fail_closed",
        "isolation": "in_process",
        "lifecycle": {
          "data_owner": "core-authority",
          "deprecated": false,
          "introduced": "1.0.0"
        },
        "provider_id": "rumi_tool_approval_bridge_pack.tool-approval.authorize",
        "required_capabilities": [
          "tool.authority.consume"
        ],
        "security": "restricted"
      },
      "revision_digest": "sha256:1c5d87db10ba43552b1b615cb4e644f9b12127eebcf3d1bf4ef8cbe995155630",
      "schema_catalog": {
        "sha256:a2c799262a3ce3c19ef5cdd983bf3d12b43ab3c426227091b909dcb7054738c0": {
          "type": "object"
        }
      },
      "status": "accepted",
      "version": "1.0.0"
    }
  ],
  "pack_id": "rumi_tool_approval_bridge_pack",
  "source_identity": "sha256:875d534c9a41b2844e4bd78cba38740dd66f9d108ab238649d8d1123989bf00a"
}
