{
  "catalog_api_version": "io.tobkiri.pack-contract-catalog.v4",
  "contracts": [
    {
      "contract_api_version": "io.tobkiri.contract.v4",
      "contract_id": "tobkiri.action.connector.route.v1",
      "operations": [
        {
          "effect_ceiling": [
            "capability:connector.route"
          ],
          "error_schema_digest": "sha256:a2c799262a3ce3c19ef5cdd983bf3d12b43ab3c426227091b909dcb7054738c0",
          "idempotency": {
            "mode": "none"
          },
          "input_schema_digest": "sha256:a2c799262a3ce3c19ef5cdd983bf3d12b43ab3c426227091b909dcb7054738c0",
          "operation_id": "rumi_connector_turn_adapter_pack.connector-turn-route",
          "output_schema_digest": "sha256:a2c799262a3ce3c19ef5cdd983bf3d12b43ab3c426227091b909dcb7054738c0",
          "scope_semantics": "declarative"
        }
      ],
      "owner": "rumi_connector_turn_adapter_pack",
      "provenance": {
        "evidence": [
          {
            "digest": "sha256:18e1d6aed69d192c9baa13b1d9281616741be83ce17a6cc0c386a9f431fcd33d",
            "path": "schemas/pack_v4_catalog.v1.json",
            "rule_id": "canonical-pack-v4-source-record"
          }
        ],
        "generator": "tobkiri.scripts.migrate_pack_artifacts_v4",
        "generator_version": "1.0.0",
        "normative": true,
        "repository_commit": "1329f300cd2a8e15170edb1accce8d7c3167882b",
        "repository_tree": "8820370fd87572920444d7c9dc642735b35194e6e1610ad99d242a5958fb876c",
        "schema": "io.tobkiri.provenance.v1",
        "source_digest": "sha256:18e1d6aed69d192c9baa13b1d9281616741be83ce17a6cc0c386a9f431fcd33d",
        "source_kind": "migration",
        "source_path": "schemas/pack_v4_catalog.v1.json#/packs/rumi_connector_turn_adapter_pack"
      },
      "provider_semantics": {
        "cardinality": "many",
        "failure": "isolate",
        "instance_key": "turn",
        "isolation": "in_process",
        "lifecycle": {
          "data_owner": "rumi_conversation_store_pack",
          "deprecated": false,
          "introduced": "1.0.0"
        },
        "provider_id": "rumi_connector_turn_adapter_pack.connector-route.turn",
        "required_capabilities": [
          "connector.route"
        ],
        "security": "sensitive"
      },
      "revision_digest": "sha256:33d2789fcd1a5bf1ff4b52597daeef29f1692a7fe1e9e0c7764ddc37295b9d9d",
      "schema_catalog": {
        "sha256:a2c799262a3ce3c19ef5cdd983bf3d12b43ab3c426227091b909dcb7054738c0": {
          "type": "object"
        }
      },
      "status": "accepted",
      "version": "1.0.0"
    }
  ],
  "pack_id": "rumi_connector_turn_adapter_pack",
  "source_identity": "sha256:18e1d6aed69d192c9baa13b1d9281616741be83ce17a6cc0c386a9f431fcd33d"
}
