{
  "catalog_api_version": "io.tobkiri.pack-contract-catalog.v4",
  "contracts": [
    {
      "contract_api_version": "io.tobkiri.contract.v4",
      "contract_id": "tobkiri.service.tool.execute.v1",
      "operations": [
        {
          "effect_ceiling": [
            "capability:tool.execute",
            "host:brokered-execution"
          ],
          "error_schema_digest": "sha256:a2c799262a3ce3c19ef5cdd983bf3d12b43ab3c426227091b909dcb7054738c0",
          "idempotency": {
            "mode": "none"
          },
          "input_schema_digest": "sha256:a2c799262a3ce3c19ef5cdd983bf3d12b43ab3c426227091b909dcb7054738c0",
          "operation_id": "rumi_tool_capability_executor_pack.tool-capability-execute",
          "output_schema_digest": "sha256:a2c799262a3ce3c19ef5cdd983bf3d12b43ab3c426227091b909dcb7054738c0",
          "scope_semantics": "host_broker"
        }
      ],
      "owner": "rumi_tool_capability_executor_pack",
      "provenance": {
        "evidence": [
          {
            "digest": "sha256:99b8832115f05aac77e246aaeb27ae8ea4f5e352e879fbd55607d2b77ba80db2",
            "path": "schemas/pack_v4_catalog.v1.json",
            "rule_id": "canonical-pack-v4-source-record"
          }
        ],
        "generator": "tobkiri.scripts.migrate_pack_artifacts_v4",
        "generator_version": "1.0.0",
        "normative": true,
        "repository_commit": "1329f300cd2a8e15170edb1accce8d7c3167882b",
        "repository_tree": "8820370fd87572920444d7c9dc642735b35194e6e1610ad99d242a5958fb876c",
        "schema": "io.tobkiri.provenance.v1",
        "source_digest": "sha256:99b8832115f05aac77e246aaeb27ae8ea4f5e352e879fbd55607d2b77ba80db2",
        "source_kind": "migration",
        "source_path": "schemas/pack_v4_catalog.v1.json#/packs/rumi_tool_capability_executor_pack"
      },
      "provider_semantics": {
        "cardinality": "many",
        "failure": "fail_closed",
        "isolation": "in_process",
        "lifecycle": {
          "data_owner": "domain-service",
          "deprecated": false,
          "introduced": "1.0.0"
        },
        "provider_id": "rumi_tool_capability_executor_pack.tool-executor.capability",
        "required_capabilities": [
          "tool.execute"
        ],
        "routing_keys": [
          "capability"
        ],
        "security": "restricted"
      },
      "revision_digest": "sha256:96ba9605d95950428119a955d2096ea1bc3cdd61088067a8e1121589d395cc87",
      "schema_catalog": {
        "sha256:a2c799262a3ce3c19ef5cdd983bf3d12b43ab3c426227091b909dcb7054738c0": {
          "type": "object"
        }
      },
      "status": "accepted",
      "version": "1.0.0"
    }
  ],
  "pack_id": "rumi_tool_capability_executor_pack",
  "source_identity": "sha256:99b8832115f05aac77e246aaeb27ae8ea4f5e352e879fbd55607d2b77ba80db2"
}
