{
  "catalog_api_version": "io.tobkiri.pack-contract-catalog.v4",
  "contracts": [
    {
      "contract_api_version": "io.tobkiri.contract.v4",
      "contract_id": "tobkiri.service.connector.adapter.v1",
      "operations": [
        {
          "effect_ceiling": [
            "capability:connector.adapter.verify",
            "capability:connector.delivery.execute",
            "host:brokered-execution"
          ],
          "error_schema_digest": "sha256:a2c799262a3ce3c19ef5cdd983bf3d12b43ab3c426227091b909dcb7054738c0",
          "idempotency": {
            "mode": "none"
          },
          "input_schema_digest": "sha256:a2c799262a3ce3c19ef5cdd983bf3d12b43ab3c426227091b909dcb7054738c0",
          "operation_id": "rumi_email_connector_pack.email-adapter",
          "output_schema_digest": "sha256:a2c799262a3ce3c19ef5cdd983bf3d12b43ab3c426227091b909dcb7054738c0",
          "scope_semantics": "host_broker"
        }
      ],
      "owner": "rumi_email_connector_pack",
      "provenance": {
        "evidence": [
          {
            "digest": "sha256:2584891a984887e35fa7e3e9194a366bdc78dae1c16a79a01367dfe738add922",
            "path": "schemas/pack_v4_catalog.v1.json",
            "rule_id": "canonical-pack-v4-source-record"
          }
        ],
        "generator": "tobkiri.scripts.migrate_pack_artifacts_v4",
        "generator_version": "1.0.0",
        "normative": true,
        "repository_commit": "1329f300cd2a8e15170edb1accce8d7c3167882b",
        "repository_tree": "8820370fd87572920444d7c9dc642735b35194e6e1610ad99d242a5958fb876c",
        "schema": "io.tobkiri.provenance.v1",
        "source_digest": "sha256:2584891a984887e35fa7e3e9194a366bdc78dae1c16a79a01367dfe738add922",
        "source_kind": "migration",
        "source_path": "schemas/pack_v4_catalog.v1.json#/packs/rumi_email_connector_pack"
      },
      "provider_semantics": {
        "cardinality": "many",
        "failure": "isolate",
        "instance_key": "email",
        "isolation": "process",
        "lifecycle": {
          "deprecated": false,
          "introduced": "1.0.0"
        },
        "provider_id": "rumi_email_connector_pack.connector.email",
        "required_capabilities": [
          "connector.adapter.verify",
          "connector.delivery.execute"
        ],
        "security": "restricted"
      },
      "revision_digest": "sha256:fa9f4c7c3c713f8b16802cdd6968cc6ef67ed57b97e2edf3a99f3e1017c4d018",
      "schema_catalog": {
        "sha256:a2c799262a3ce3c19ef5cdd983bf3d12b43ab3c426227091b909dcb7054738c0": {
          "type": "object"
        }
      },
      "status": "accepted",
      "version": "1.0.0"
    }
  ],
  "pack_id": "rumi_email_connector_pack",
  "source_identity": "sha256:2584891a984887e35fa7e3e9194a366bdc78dae1c16a79a01367dfe738add922"
}
