{
  "catalog_api_version": "io.tobkiri.pack-contract-catalog.v4",
  "contracts": [
    {
      "contract_api_version": "io.tobkiri.contract.v4",
      "contract_id": "tobkiri.action.desktop.host.v1",
      "operations": [
        {
          "effect_ceiling": [
            "capability:desktop.host.control"
          ],
          "error_schema_digest": "sha256:a2c799262a3ce3c19ef5cdd983bf3d12b43ab3c426227091b909dcb7054738c0",
          "idempotency": {
            "mode": "none"
          },
          "input_schema_digest": "sha256:a2c799262a3ce3c19ef5cdd983bf3d12b43ab3c426227091b909dcb7054738c0",
          "operation_id": "rumi_desktop_host_service_pack.desktop-host-control",
          "output_schema_digest": "sha256:a2c799262a3ce3c19ef5cdd983bf3d12b43ab3c426227091b909dcb7054738c0",
          "scope_semantics": "declarative"
        }
      ],
      "owner": "rumi_desktop_host_service_pack",
      "provenance": {
        "evidence": [
          {
            "digest": "sha256:ca73b3e6f40b82deeb3c77a28d1d70fba39feac0cbd166b4d8a0b68c87495d40",
            "path": "schemas/pack_v4_catalog.v1.json",
            "rule_id": "canonical-pack-v4-source-record"
          }
        ],
        "generator": "tobkiri.scripts.migrate_pack_artifacts_v4",
        "generator_version": "1.0.0",
        "normative": true,
        "repository_commit": "1329f300cd2a8e15170edb1accce8d7c3167882b",
        "repository_tree": "8820370fd87572920444d7c9dc642735b35194e6e1610ad99d242a5958fb876c",
        "schema": "io.tobkiri.provenance.v1",
        "source_digest": "sha256:ca73b3e6f40b82deeb3c77a28d1d70fba39feac0cbd166b4d8a0b68c87495d40",
        "source_kind": "migration",
        "source_path": "schemas/pack_v4_catalog.v1.json#/packs/rumi_desktop_host_service_pack"
      },
      "provider_semantics": {
        "cardinality": "one",
        "failure": "fail_closed",
        "isolation": "process",
        "lifecycle": {
          "data_owner": "rumi_desktop_host_service_pack",
          "deprecated": false,
          "introduced": "1.0.0"
        },
        "provider_id": "rumi_desktop_host_service_pack.desktop-host.control",
        "required_capabilities": [
          "desktop.host.control"
        ],
        "security": "restricted"
      },
      "revision_digest": "sha256:45a731410e1f6a11b04f6611b01991a5415dc65dc61e2418ea70aaa1fd09523c",
      "schema_catalog": {
        "sha256:a2c799262a3ce3c19ef5cdd983bf3d12b43ab3c426227091b909dcb7054738c0": {
          "type": "object"
        }
      },
      "status": "accepted",
      "version": "1.0.0"
    },
    {
      "contract_api_version": "io.tobkiri.contract.v4",
      "contract_id": "tobkiri.resource.desktop.host.v1",
      "operations": [
        {
          "effect_ceiling": [
            "capability:desktop.host.observe"
          ],
          "error_schema_digest": "sha256:a2c799262a3ce3c19ef5cdd983bf3d12b43ab3c426227091b909dcb7054738c0",
          "idempotency": {
            "mode": "none"
          },
          "input_schema_digest": "sha256:a2c799262a3ce3c19ef5cdd983bf3d12b43ab3c426227091b909dcb7054738c0",
          "operation_id": "rumi_desktop_host_service_pack.desktop-host-observe",
          "output_schema_digest": "sha256:a2c799262a3ce3c19ef5cdd983bf3d12b43ab3c426227091b909dcb7054738c0",
          "scope_semantics": "declarative"
        }
      ],
      "owner": "rumi_desktop_host_service_pack",
      "provenance": {
        "evidence": [
          {
            "digest": "sha256:ca73b3e6f40b82deeb3c77a28d1d70fba39feac0cbd166b4d8a0b68c87495d40",
            "path": "schemas/pack_v4_catalog.v1.json",
            "rule_id": "canonical-pack-v4-source-record"
          }
        ],
        "generator": "tobkiri.scripts.migrate_pack_artifacts_v4",
        "generator_version": "1.0.0",
        "normative": true,
        "repository_commit": "1329f300cd2a8e15170edb1accce8d7c3167882b",
        "repository_tree": "8820370fd87572920444d7c9dc642735b35194e6e1610ad99d242a5958fb876c",
        "schema": "io.tobkiri.provenance.v1",
        "source_digest": "sha256:ca73b3e6f40b82deeb3c77a28d1d70fba39feac0cbd166b4d8a0b68c87495d40",
        "source_kind": "migration",
        "source_path": "schemas/pack_v4_catalog.v1.json#/packs/rumi_desktop_host_service_pack"
      },
      "provider_semantics": {
        "cardinality": "one",
        "failure": "fail_closed",
        "isolation": "process",
        "lifecycle": {
          "data_owner": "rumi_desktop_host_service_pack",
          "deprecated": false,
          "introduced": "1.0.0"
        },
        "provider_id": "rumi_desktop_host_service_pack.desktop-host.observe",
        "required_capabilities": [
          "desktop.host.observe"
        ],
        "security": "sensitive"
      },
      "revision_digest": "sha256:0010a537ece2b635b57a4288ae8ea9661025140cf6b28a8c864b703522b52205",
      "schema_catalog": {
        "sha256:a2c799262a3ce3c19ef5cdd983bf3d12b43ab3c426227091b909dcb7054738c0": {
          "type": "object"
        }
      },
      "status": "accepted",
      "version": "1.0.0"
    }
  ],
  "pack_id": "rumi_desktop_host_service_pack",
  "source_identity": "sha256:ca73b3e6f40b82deeb3c77a28d1d70fba39feac0cbd166b4d8a0b68c87495d40"
}
