{
  "catalog_api_version": "io.tobkiri.pack-contract-catalog.v4",
  "contracts": [
    {
      "contract_api_version": "io.tobkiri.contract.v4",
      "contract_id": "tobkiri.transport.connector.inbound.v1",
      "operations": [
        {
          "effect_ceiling": [
            "capability:connector.inbound.receive"
          ],
          "error_schema_digest": "sha256:a2c799262a3ce3c19ef5cdd983bf3d12b43ab3c426227091b909dcb7054738c0",
          "idempotency": {
            "mode": "none"
          },
          "input_schema_digest": "sha256:a2c799262a3ce3c19ef5cdd983bf3d12b43ab3c426227091b909dcb7054738c0",
          "operation_id": "rumi_connector_inbound_broker_pack.connector-inbound",
          "output_schema_digest": "sha256:a2c799262a3ce3c19ef5cdd983bf3d12b43ab3c426227091b909dcb7054738c0",
          "scope_semantics": "declarative"
        }
      ],
      "owner": "rumi_connector_inbound_broker_pack",
      "provenance": {
        "evidence": [
          {
            "digest": "sha256:8576606a39b3e9c691c4f0d5da80bbbfb59085f6fa1bcfd165c2f31af7dca04f",
            "path": "schemas/pack_v4_catalog.v1.json",
            "rule_id": "canonical-pack-v4-source-record"
          }
        ],
        "generator": "tobkiri.scripts.migrate_pack_artifacts_v4",
        "generator_version": "1.0.0",
        "normative": true,
        "repository_commit": "1329f300cd2a8e15170edb1accce8d7c3167882b",
        "repository_tree": "8820370fd87572920444d7c9dc642735b35194e6e1610ad99d242a5958fb876c",
        "schema": "io.tobkiri.provenance.v1",
        "source_digest": "sha256:8576606a39b3e9c691c4f0d5da80bbbfb59085f6fa1bcfd165c2f31af7dca04f",
        "source_kind": "migration",
        "source_path": "schemas/pack_v4_catalog.v1.json#/packs/rumi_connector_inbound_broker_pack"
      },
      "provider_semantics": {
        "cardinality": "one",
        "failure": "fail_closed",
        "isolation": "process",
        "lifecycle": {
          "data_owner": "rumi_connector_inbound_broker_pack",
          "deprecated": false,
          "introduced": "1.0.0"
        },
        "provider_id": "rumi_connector_inbound_broker_pack.connector-inbound.receive",
        "required_capabilities": [
          "connector.inbound.receive"
        ],
        "security": "sensitive"
      },
      "revision_digest": "sha256:748cd63a8b4b645683cf600b5c80e53fc6df8041acd74738d268075b8f935bad",
      "schema_catalog": {
        "sha256:a2c799262a3ce3c19ef5cdd983bf3d12b43ab3c426227091b909dcb7054738c0": {
          "type": "object"
        }
      },
      "status": "accepted",
      "version": "1.0.0"
    }
  ],
  "pack_id": "rumi_connector_inbound_broker_pack",
  "source_identity": "sha256:8576606a39b3e9c691c4f0d5da80bbbfb59085f6fa1bcfd165c2f31af7dca04f"
}
