{
  "catalog_api_version": "io.tobkiri.pack-contract-catalog.v4",
  "contracts": [
    {
      "contract_api_version": "io.tobkiri.contract.v4",
      "contract_id": "tobkiri.service.connector.adapter.v1",
      "operations": [
        {
          "effect_ceiling": [
            "capability:connector.adapter.verify",
            "capability:connector.delivery.execute",
            "host:brokered-execution"
          ],
          "error_schema_digest": "sha256:a2c799262a3ce3c19ef5cdd983bf3d12b43ab3c426227091b909dcb7054738c0",
          "idempotency": {
            "mode": "none"
          },
          "input_schema_digest": "sha256:a2c799262a3ce3c19ef5cdd983bf3d12b43ab3c426227091b909dcb7054738c0",
          "operation_id": "rumi_slack_connector_pack.slack-adapter",
          "output_schema_digest": "sha256:a2c799262a3ce3c19ef5cdd983bf3d12b43ab3c426227091b909dcb7054738c0",
          "scope_semantics": "host_broker"
        }
      ],
      "owner": "rumi_slack_connector_pack",
      "provenance": {
        "evidence": [
          {
            "digest": "sha256:bdfff37abee7af7cad6c1a51a7d3fcf236b78d81efbb7e56169a0de7a0257e44",
            "path": "schemas/pack_v4_catalog.v1.json",
            "rule_id": "canonical-pack-v4-source-record"
          }
        ],
        "generator": "tobkiri.scripts.migrate_pack_artifacts_v4",
        "generator_version": "1.0.0",
        "normative": true,
        "repository_commit": "1329f300cd2a8e15170edb1accce8d7c3167882b",
        "repository_tree": "8820370fd87572920444d7c9dc642735b35194e6e1610ad99d242a5958fb876c",
        "schema": "io.tobkiri.provenance.v1",
        "source_digest": "sha256:bdfff37abee7af7cad6c1a51a7d3fcf236b78d81efbb7e56169a0de7a0257e44",
        "source_kind": "migration",
        "source_path": "schemas/pack_v4_catalog.v1.json#/packs/rumi_slack_connector_pack"
      },
      "provider_semantics": {
        "cardinality": "many",
        "failure": "isolate",
        "instance_key": "slack",
        "isolation": "process",
        "lifecycle": {
          "deprecated": false,
          "introduced": "1.0.0"
        },
        "provider_id": "rumi_slack_connector_pack.connector.slack",
        "required_capabilities": [
          "connector.adapter.verify",
          "connector.delivery.execute"
        ],
        "security": "restricted"
      },
      "revision_digest": "sha256:638ef8248d9e0ec02c0bf335732bff3457ea32daeb5249ace4b3e71d89095320",
      "schema_catalog": {
        "sha256:a2c799262a3ce3c19ef5cdd983bf3d12b43ab3c426227091b909dcb7054738c0": {
          "type": "object"
        }
      },
      "status": "accepted",
      "version": "1.0.0"
    },
    {
      "contract_api_version": "io.tobkiri.contract.v4",
      "contract_id": "tobkiri.service.connector.oauth.provider.v1",
      "operations": [
        {
          "effect_ceiling": [
            "capability:connector.oauth.exchange",
            "host:brokered-execution"
          ],
          "error_schema_digest": "sha256:a2c799262a3ce3c19ef5cdd983bf3d12b43ab3c426227091b909dcb7054738c0",
          "idempotency": {
            "mode": "none"
          },
          "input_schema_digest": "sha256:a2c799262a3ce3c19ef5cdd983bf3d12b43ab3c426227091b909dcb7054738c0",
          "operation_id": "rumi_slack_connector_pack.slack-oauth-provider",
          "output_schema_digest": "sha256:a2c799262a3ce3c19ef5cdd983bf3d12b43ab3c426227091b909dcb7054738c0",
          "scope_semantics": "host_broker"
        }
      ],
      "owner": "rumi_slack_connector_pack",
      "provenance": {
        "evidence": [
          {
            "digest": "sha256:bdfff37abee7af7cad6c1a51a7d3fcf236b78d81efbb7e56169a0de7a0257e44",
            "path": "schemas/pack_v4_catalog.v1.json",
            "rule_id": "canonical-pack-v4-source-record"
          }
        ],
        "generator": "tobkiri.scripts.migrate_pack_artifacts_v4",
        "generator_version": "1.0.0",
        "normative": true,
        "repository_commit": "1329f300cd2a8e15170edb1accce8d7c3167882b",
        "repository_tree": "8820370fd87572920444d7c9dc642735b35194e6e1610ad99d242a5958fb876c",
        "schema": "io.tobkiri.provenance.v1",
        "source_digest": "sha256:bdfff37abee7af7cad6c1a51a7d3fcf236b78d81efbb7e56169a0de7a0257e44",
        "source_kind": "migration",
        "source_path": "schemas/pack_v4_catalog.v1.json#/packs/rumi_slack_connector_pack"
      },
      "provider_semantics": {
        "cardinality": "many",
        "failure": "isolate",
        "instance_key": "slack",
        "isolation": "process",
        "lifecycle": {
          "deprecated": false,
          "introduced": "1.0.0"
        },
        "provider_id": "rumi_slack_connector_pack.connector-oauth.slack",
        "required_capabilities": [
          "connector.oauth.exchange"
        ],
        "security": "restricted"
      },
      "revision_digest": "sha256:fd2fee7c6509a7b989307a14d4b792d24a0297a7de284ee77047cfb176d63448",
      "schema_catalog": {
        "sha256:a2c799262a3ce3c19ef5cdd983bf3d12b43ab3c426227091b909dcb7054738c0": {
          "type": "object"
        }
      },
      "status": "accepted",
      "version": "1.0.0"
    }
  ],
  "pack_id": "rumi_slack_connector_pack",
  "source_identity": "sha256:bdfff37abee7af7cad6c1a51a7d3fcf236b78d81efbb7e56169a0de7a0257e44"
}
