{
  "catalog_api_version": "io.tobkiri.pack-contract-catalog.v4",
  "contracts": [
    {
      "contract_api_version": "io.tobkiri.contract.v4",
      "contract_id": "tobkiri.service.ai.stream.normalize.v1",
      "operations": [
        {
          "effect_ceiling": [
            "capability:ai.stream.normalize",
            "host:brokered-execution"
          ],
          "error_schema_digest": "sha256:a2c799262a3ce3c19ef5cdd983bf3d12b43ab3c426227091b909dcb7054738c0",
          "idempotency": {
            "mode": "none"
          },
          "input_schema_digest": "sha256:a2c799262a3ce3c19ef5cdd983bf3d12b43ab3c426227091b909dcb7054738c0",
          "operation_id": "rumi_ai_stream_pack.ai-stream-normalize",
          "output_schema_digest": "sha256:a2c799262a3ce3c19ef5cdd983bf3d12b43ab3c426227091b909dcb7054738c0",
          "scope_semantics": "host_broker"
        }
      ],
      "owner": "rumi_ai_stream_pack",
      "provenance": {
        "evidence": [
          {
            "digest": "sha256:b07d05d87207e0f894ab63b6c75edf74097d47bcc08a40589f2c973003af061d",
            "path": "schemas/pack_v4_catalog.v1.json",
            "rule_id": "canonical-pack-v4-source-record"
          }
        ],
        "generator": "tobkiri.scripts.migrate_pack_artifacts_v4",
        "generator_version": "1.0.0",
        "normative": true,
        "repository_commit": "1329f300cd2a8e15170edb1accce8d7c3167882b",
        "repository_tree": "8820370fd87572920444d7c9dc642735b35194e6e1610ad99d242a5958fb876c",
        "schema": "io.tobkiri.provenance.v1",
        "source_digest": "sha256:b07d05d87207e0f894ab63b6c75edf74097d47bcc08a40589f2c973003af061d",
        "source_kind": "migration",
        "source_path": "schemas/pack_v4_catalog.v1.json#/packs/rumi_ai_stream_pack"
      },
      "provider_semantics": {
        "cardinality": "one",
        "failure": "fail_closed",
        "isolation": "in_process",
        "lifecycle": {
          "data_owner": "rumi_ai_stream_pack",
          "deprecated": false,
          "introduced": "1.0.0"
        },
        "provider_id": "rumi_ai_stream_pack.ai-stream.normalize",
        "required_capabilities": [
          "ai.stream.normalize"
        ],
        "security": "sensitive"
      },
      "revision_digest": "sha256:88929a94dedfbbc04a8ca78a3c88c01bcb2703a480402e8ad0afbfea8b62d6ad",
      "schema_catalog": {
        "sha256:a2c799262a3ce3c19ef5cdd983bf3d12b43ab3c426227091b909dcb7054738c0": {
          "type": "object"
        }
      },
      "status": "accepted",
      "version": "1.0.0"
    }
  ],
  "pack_id": "rumi_ai_stream_pack",
  "source_identity": "sha256:b07d05d87207e0f894ab63b6c75edf74097d47bcc08a40589f2c973003af061d"
}
